<?xml version="1.0" encoding="ISO-8859-1" ?>
<!--
   Licensed to the Apache Software Foundation (ASF) under one or more
   contributor license agreements.  See the NOTICE file distributed with
   this work for additional information regarding copyright ownership.
   The ASF licenses this file to You under the Apache License, Version 2.0
   (the "License"); you may not use this file except in compliance with
   the License.  You may obtain a copy of the License at

       https://www.apache.org/licenses/LICENSE-2.0

   Unless required by applicable law or agreed to in writing, software
   distributed under the License is distributed on an "AS IS" BASIS,
   WITHOUT WARRANTIES OR CONDITIONS OF ANY KIND, either express or implied.
   See the License for the specific language governing permissions and
   limitations under the License.
-->
<configuration
           xmlns:xsi="http://www.w3.org/2001/XMLSchema-instance"
           xsi:noNamespaceSchemaLocation="https://commons.apache.org/testMultiConfiguration.xsd">
  <colors>
    <background>#2222222</background>
    <text>#000000</text>
    <header>#222222</header>
    <link normal="#020202" visited="#202020"/>
    <default>${colors.header3}</default>
  </colors>
  <rowsPerPage>25</rowsPerPage>
  <buttons>
    <name>OK-2,Cancel-2,Help-2</name>
  </buttons>
  <numberFormat pattern="###\,###.##"/>
</configuration>